    1   0.000000 192.168.2.142 55964 185.220.205.220 443 TLSv1.2 1293 Application Data
    2   0.033494 185.220.205.220 443 192.168.2.142 55964 TLSv1.2 474 Application Data
    3   0.033523 192.168.2.142 55964 185.220.205.220 443 TCP 66 55964 → 443 [ACK] Seq=1228 Ack=409 Win=501 Len=0 TSval=3527912886 TSecr=2674175589
    4   2.086035 192.168.2.142 56692 185.64.190.80 443 TCP 66 56692 → 443 [ACK] Seq=1 Ack=1 Win=501 Len=0 TSval=3619739100 TSecr=2827370354
    5   2.086121 192.168.2.142 56690 185.64.190.80 443 TCP 66 56690 → 443 [ACK] Seq=1 Ack=1 Win=501 Len=0 TSval=3619739100 TSecr=2827370469
    6   2.086162 192.168.2.142 54416 213.19.147.150 443 TCP 66 54416 → 443 [ACK] Seq=1 Ack=1 Win=501 Len=0 TSval=3748357517 TSecr=3571605306
    7   2.086198 192.168.2.142 54462 213.19.147.150 443 TCP 66 54462 → 443 [ACK] Seq=1 Ack=1 Win=501 Len=0 TSval=3748357517 TSecr=3571605314
    8   2.086229 192.168.2.142 43758 151.101.134.49 443 TCP 66 43758 → 443 [ACK] Seq=1 Ack=1 Win=501 Len=0 TSval=2714601963 TSecr=258321483
    9   2.086259 192.168.2.142 38894 87.98.252.5  443 TCP 66 38894 → 443 [ACK] Seq=1 Ack=1 Win=501 Len=0 TSval=2850184968 TSecr=3152863894
   10   2.086288 192.168.2.142 47610 216.58.211.226 443 TCP 66 47610 → 443 [ACK] Seq=1 Ack=1 Win=501 Len=0 TSval=1031976903 TSecr=1270388203
   11   2.086317 192.168.2.142 36902 54.36.172.109 443 TCP 66 36902 → 443 [ACK] Seq=1 Ack=1 Win=501 Len=0 TSval=514007570 TSecr=3327209295
   12   2.086347 192.168.2.142 48304 52.57.47.66  443 TCP 66 48304 → 443 [ACK] Seq=1 Ack=1 Win=501 Len=0 TSval=752613984 TSecr=2993027459
   13   2.086375 192.168.2.142 52860 172.67.73.8  443 TCP 54 52860 → 443 [ACK] Seq=1 Ack=1 Win=501 Len=0
   14   2.091418 216.58.211.226 443 192.168.2.142 47610 TCP 66 [TCP ACKed unseen segment] 443 → 47610 [ACK] Seq=1 Ack=2 Win=259 Len=0 TSval=1270435253 TSecr=1031929849
   15   2.092442 151.101.134.49 443 192.168.2.142 43758 TCP 66 [TCP ACKed unseen segment] 443 → 43758 [ACK] Seq=1 Ack=2 Win=72 Len=0 TSval=258333145 TSecr=2714555271
   16   2.092450  172.67.73.8 443 192.168.2.142 52860 TCP 60 [TCP ACKed unseen segment] 443 → 52860 [ACK] Seq=1 Ack=2 Win=68 Len=0
   17   2.111192  87.98.252.5 443 192.168.2.142 38894 TCP 66 [TCP ACKed unseen segment] 443 → 38894 [ACK] Seq=1 Ack=2 Win=273 Len=0 TSval=3152910672 TSecr=2850138191
   18   2.111217 185.64.190.80 443 192.168.2.142 56692 TCP 66 [TCP ACKed unseen segment] 443 → 56692 [ACK] Seq=1 Ack=2 Win=4442 Len=0 TSval=2827416999 TSecr=3619692478
   19   2.111221 185.64.190.80 443 192.168.2.142 56690 TCP 66 [TCP ACKed unseen segment] 443 → 56690 [ACK] Seq=1 Ack=2 Win=4961 Len=0 TSval=2827416999 TSecr=3619692593
   20   2.115669  52.57.47.66 443 192.168.2.142 48304 TCP 66 [TCP ACKed unseen segment] 443 → 48304 [ACK] Seq=1 Ack=2 Win=114 Len=0 TSval=2993039075 TSecr=752567473
   21   2.117397 213.19.147.150 443 192.168.2.142 54462 TCP 66 [TCP ACKed unseen segment] 443 → 54462 [ACK] Seq=1 Ack=2 Win=8688 Len=0 TSval=3571616931 TSecr=3748311079
   22   2.117404 213.19.147.150 443 192.168.2.142 54416 TCP 66 [TCP ACKed unseen segment] 443 → 54416 [ACK] Seq=1 Ack=2 Win=11584 Len=0 TSval=3571616931 TSecr=3748311046
   23   2.136950 54.36.172.109 443 192.168.2.142 36902 TCP 66 [TCP ACKed unseen segment] 443 → 36902 [ACK] Seq=1 Ack=2 Win=248 Len=0 TSval=3327220928 TSecr=513961087
   24   4.134275 192.168.2.142 55806 172.217.168.174 443 TCP 66 55806 → 443 [ACK] Seq=1 Ack=1 Win=501 Len=0 TSval=3072312728 TSecr=1680558583
   25   4.138846 172.217.168.174 443 192.168.2.142 55806 TCP 66 [TCP ACKed unseen segment] 443 → 55806 [ACK] Seq=1 Ack=2 Win=245 Len=0 TSval=1680603638 TSecr=3072222269
   26   4.231785 192.168.2.142 52688 216.58.211.34 443 TLSv1.2 230 Application Data
   27   4.235559 216.58.211.34 443 192.168.2.142 52688 TCP 66 443 → 52688 [ACK] Seq=1 Ack=165 Win=493 Len=0 TSval=3931376530 TSecr=1389087414
   28   4.258179 216.58.211.34 443 192.168.2.142 52688 TLSv1.2 134 Application Data
   29   4.258203 216.58.211.34 443 192.168.2.142 52688 TLSv1.2 139 Application Data
   30   4.258205 216.58.211.34 443 192.168.2.142 52688 TLSv1.2 97 Application Data
   31   4.258207 216.58.211.34 443 192.168.2.142 52688 TLSv1.2 105 Application Data
   32   4.258262 192.168.2.142 52688 216.58.211.34 443 TCP 66 52688 → 443 [ACK] Seq=165 Ack=212 Win=501 Len=0 TSval=1389087441 TSecr=3931376553
   33   4.259320 192.168.2.142 52688 216.58.211.34 443 TLSv1.2 105 Application Data
   34   4.267886 216.58.211.34 443 192.168.2.142 52688 TCP 66 443 → 52688 [ACK] Seq=212 Ack=204 Win=493 Len=0 TSval=3931376562 TSecr=1389087442
